key	decision	canonical_key	curation_reason	curated_description	source_context	visual_note	reviewed	context_checked
local:transformer-circuits.pub/2022/in-context-learning-and-induction-heads/images/img-018.png	keep			MLP가 있는 small model에서는 5L/6L부터 induction head가 마지막 layer보다 second-to-last layer에 더 많이 생김을 보여주는 위치 산점도.	In-context Learning and Induction Heads Where induction heads form: in small models with MLPs, 5L and 6L induction heads form more in the second-to-last layer.	여러 작은 산점도 패널에서 head 점들이 depth 축을 따라 배치되고 prefix matching score가 y축으로 표시된다.	yes	yes
local:transformer-circuits.pub/2022/in-context-learning-and-induction-heads/images/img-019.png	keep			full-scale 모델에서는 induction head 다수가 모델 깊이의 절반 이전에도 형성됨을 보여주는 위치 산점도.	In-context Learning and Induction Heads: in 24L and 40L full-scale models, the majority of induction heads form before the halfway point in depth.	불투명/반투명 점들이 섞인 여러 산점도에서 layer depth별 induction head 위치가 보인다.	yes	yes
local:transformer-circuits.pub/2022/in-context-learning-and-induction-heads/images/img-020.png	keep			head activation evaluator에서 prefix matching 점수가 양수인 head일수록 copying score도 양수일 가능성이 높다는 분포 그래프.	In-context Learning and Induction Heads Distribution of scores: heads with positive prefix matching score are more likely to have positive copying score.	두 개의 산점도 패널에 prefix matching과 copying score 점들이 색상별로 흩어져 있다.	yes	yes
local:transformer-circuits.pub/2022/in-context-learning-and-induction-heads/images/img-021.png	keep			copying evaluator가 OV matrix의 고유값 기반 측정치와 잘 상관된다는 검증 산점도.	In-context Learning and Induction Heads Validating head activation evaluators: copying evaluator correlates with the OV matrix eigenvalue measure.	상승 추세를 보이는 산점도에 head 점들이 색상별로 찍혀 있고 기준선/축 라벨이 있다.	yes	yes
local:transformer-circuits.pub/2022/in-context-learning-and-induction-heads/images/img-022.png	keep			prefix matching evaluator가 previous-token QK circuit의 eigenvalue trace와 잘 상관됨을 보여주는 검증 산점도.	In-context Learning and Induction Heads Validating head activation evaluators: prefix matching evaluator correlates with the trace of QK eigenvalues for the previous-token term.	점들이 대각 방향으로 모인 산점도이며 QK eigenvalue trace와 prefix matching 점수 축이 보인다.	yes	yes
local:transformer-circuits.pub/2022/solu/images/img-003.png	keep			작은 신경망이 sparse larger model을 근사적으로 시뮬레이션할 수 있지만 feature interference가 생기는 superposition 직관 도식.	Softmax Linear Units 3.3: a small neural network may simulate a sparse larger model at the cost of interference.	여러 feature 방향과 간섭을 나타내는 작은 벡터/막대 도식이 설명 텍스트와 함께 배치되어 있다.	yes	yes
local:transformer-circuits.pub/2022/solu/images/img-004.png	keep			SoLU가 distributed vector를 작게 만들더라도 뒤의 LayerNorm이 다시 키워 superposition을 일부 통과시킬 수 있음을 설명하는 도식.	Softmax Linear Units 4.3: LayerNorm is invariant to scaling, so vectors suppressed by SoLU can be rescaled larger afterward.	SoLU와 LayerNorm 전후의 벡터 크기 변화를 단계별 박스와 화살표로 보여준다.	yes	yes
local:transformer-circuits.pub/2022/solu/images/img-006.png	keep			Lambada, ARC, TriviaQA 등 downstream task에서 SoLU와 baseline 모델 성능을 모델 크기별로 비교한 평가 그래프.	Softmax Linear Units Figure 2: downstream task performance for baseline vs SoLU on Lambada, OpenBookQA, ARC, HellaSwag, MMLU, TriviaQA, and arithmetic.	여러 작은 패널의 선 그래프가 task별 성능과 모델 크기 변화를 비교한다.	yes	yes
local:transformer-circuits.pub/2022/solu/images/img-007.png	keep			뉴런이 강하게 firing한 dataset snippet을 빨간 하이라이트로 보여주고 사람이 빠르게 해석 가능성을 판단하는 평가 예시.	Softmax Linear Units Figure 3: evaluators inspect text snippets where a neuron fires heavily, highlighted by activation magnitude.	텍스트 문단 안의 특정 토큰들이 빨간색 농도로 하이라이트되고 오른쪽에 평가 설명이 붙어 있다.	yes	yes
local:transformer-circuits.pub/2022/solu/images/img-008.png	keep			SoLU 모델 뉴런이 baseline보다 더 자주 preliminary interpretable로 판정되는 비율을 모델 크기별로 비교한 그래프.	Softmax Linear Units Figure 4: SoLU increases the fraction of preliminarily interpretable neurons versus baseline for 1L to 40L models.	파란 baseline 선과 빨간 SoLU 선, 초록 layernorm-only 점이 모델 layer 수 축 위에 표시된다.	yes	yes
local:transformer-circuits.pub/2022/solu/images/img-009.png	keep			1-layer SoLU 모델에서 base64 텍스트에 반응하는 뉴런과 그 뉴런이 올리는 출력 토큰 logits를 함께 보여주는 예시.	Softmax Linear Units Figure 5: a 1-layer SoLU neuron fires on base64 text and increases mixed-case string tokens while decreasing English words.	왼쪽에는 base64처럼 보이는 텍스트 하이라이트, 오른쪽에는 증가/감소 token 표가 나란히 있다.	yes	yes
local:transformer-circuits.pub/2022/solu/images/img-010.png	keep			같은 토큰 die가 독일어, 네덜란드어, 아프리칸스어 문맥에서 다르게 표현되는 early-layer 언어별 뉴런 예시.	Softmax Linear Units Figure 6: three early-layer neurons fire for the word die in specific non-English language contexts and not in English.	세 열의 텍스트 snippet에서 die 주변 토큰이 빨간색으로 하이라이트되어 있다.	yes	yes
local:transformer-circuits.pub/2022/solu/images/img-011.png	keep			late-layer 뉴런이 내부 단어 표현을 다시 literal output token으로 변환하는 re-tokenization 예시.	Softmax Linear Units Figure 7: late-layer neurons fire on one token while increasing the likelihood of a specific next token, decoding words into output tokens.	텍스트 예시와 다음 토큰 확률/가중치 표가 함께 배치되어 특정 출력 토큰 증가를 보여준다.	yes	yes
local:transformer-circuits.pub/2022/solu/images/img-012.png	keep			숫자가 사람 수를 셀 때만 반응하는 middle-layer 뉴런으로, SoLU 모델의 더 추상적인 feature 예시를 보여준다.	Softmax Linear Units Figure 8: a middle-layer neuron fires on numbers only when the number enumerates people.	문장 안의 숫자와 사람 관련 단어가 빨간색으로 강조된 여러 텍스트 snippet이 보인다.	yes	yes
local:transformer-circuits.pub/2022/solu/images/img-013.png	keep			LayerNorm 이후 낮은 activation 영역에서 주 hypothesis와 맞지 않는 사례가 늘어나는 interpretability illusion/feature smuggling 진단 그래프.	Softmax Linear Units Figure 9: post-LayerNorm examples are more likely to be inconsistent with the primary neuron hypothesis in the low-activation regime.	activation 구간별 inconsistent fraction을 비교하는 선/막대 그래프가 pre/post LayerNorm 조건을 나눈다.	yes	yes
