key	decision	canonical_key	curation_reason	curated_description	source_context	visual_note	reviewed	context_checked
local:transformer-circuits.pub/2025/july-update/images/img-002.png	keep			Framework 논문의 W_U W_OV W_E 양의 eigenvalue 해석을 token feature와 say feature의 upper-right submatrix로 재해석한다.	Circuits Updates - July 2025: positive eigenvalues in the copy OV submatrix correspond to sets of features upweighting matching say features.	token basis와 say-token basis 사이의 diagonal-ish matrix가 표시되어 있다.	yes	yes
local:transformer-circuits.pub/2025/july-update/images/img-003.png	keep			previous-token head가 X feature를 prev(X) feature로 옮겨 이전 token 정보를 현재 위치에 복사하는 OV circuit 도식.	Circuits Updates - July 2025: previous-token heads map current token features to previous-token features.	X/Y/Z에서 prev(X)/prev(Y)/prev(Z)로 이어지는 붉은 대각 matrix다.	yes	yes
local:transformer-circuits.pub/2025/july-update/images/img-004.png	keep			이미 prev(X) feature가 있으면 head가 이를 prev(prev(X))처럼 더 이전 token feature로 복사할 수 있음을 보여준다.	Circuits Updates - July 2025: previous-token heads may also copy existing previous-token features into deeper previous-of-previous features.	prev feature 행과 prev(prev) feature 열이 포함된 확장 matrix가 보인다.	yes	yes
local:transformer-circuits.pub/2025/july-update/images/img-005.png	keep			induction head의 QK circuit이 query X와 key prev(X)를 맞추어 반복 prefix 뒤의 다음 token을 찾는 feature-level 설명.	Circuits Updates - July 2025: induction QK circuits match query-side X features with key-side prev(X) features.	query/key feature 행렬에서 X와 prev(X)가 대응되는 붉은 대각 block이 표시된다.	yes	yes
local:transformer-circuits.pub/2025/july-update/images/img-006.png	keep			Framework의 induction QK와 previous OV 곱이 feature basis에서는 diagonal-ish matrix가 되어 양의 eigenvalue를 갖는 이유를 설명한다.	Circuits Updates - July 2025: composing induction QK with previous-token OV yields a diagonal-ish matrix in feature language.	induction query와 previous key feature를 묶은 matrix에서 붉은 diagonal이 보인다.	yes	yes
local:transformer-circuits.pub/2025/linebreaks/images/img-001.png	keep			고정 폭 줄바꿈 task에서 모델이 line width, current position, remaining distance, next word length를 계산해 newline을 예측하는 전체 요약도.	When Models Manipulate Manifolds: overview figure summarizes the linebreaking circuit and manifold geometry for character counting.	line-wrapped text, token ids, feature curves, fit/overflow heatmap, manifold trajectory가 한 장에 배치되어 있다.	yes	yes
local:transformer-circuits.pub/2025/linebreaks/images/img-002.png	keep			50자 line wrapping 제약에서 다음 단어가 들어가면 단어를 쓰고 넘치면 newline을 예측하는 두 prompt 예시.	When Models Manipulate Manifolds: example prompts show the model choosing a word or newline depending on whether the next word fits.	두 개의 line-wrapped text prompt와 correct completion이 좌우로 비교되어 있다.	yes	yes
local:transformer-circuits.pub/2025/linebreaks/images/img-003.png	keep			aluminum prompt attribution graph가 previous line width, current line position, distance from limit, planned word feature를 연결해 newline 예측 경로를 보여준다.	When Models Manipulate Manifolds: attribution graph traces the discrete-feature computation for predicting a newline.	feature node와 token snippets가 연결된 graph가 newline logit까지 이어진다.	yes	yes
local:transformer-circuits.pub/2025/linebreaks/images/img-004.png	keep			character count manifold 구성, boundary sensing, newline prediction, distributed counting algorithm을 네 단계로 요약한 roadmap 그림.	When Models Manipulate Manifolds: roadmap figure frames the mechanism as construction and manipulation of manifolds.	네 개의 작은 diagram과 그래프가 단계별 질문 아래 배치되어 있다.	yes	yes
local:transformer-circuits.pub/2025/linebreaks/images/img-005.png	keep			line character count를 나타내는 10개 feature의 tuning curve가 count가 커질수록 순차적으로 활성화되고 receptive field가 넓어짐을 보여준다.	When Models Manipulate Manifolds: character-count features tile line positions with widening receptive fields.	여러 색상의 smooth tuning curves가 line character count 축을 따라 순서대로 봉우리를 이룬다.	yes	yes
local:transformer-circuits.pub/2025/linebreaks/images/img-006.png	keep			character count PCA subspace를 ablate하면 newline token loss에만 큰 영향을 주어 character count representation이 causal함을 보여준다.	When Models Manipulate Manifolds: ablating the character-count subspace strongly affects newline prediction loss.	newline/non-newline loss effect curve가 ablated PCA dimension별로 비교된다.	yes	yes
local:transformer-circuits.pub/2025/linebreaks/images/img-007.png	keep			rank-6 character count subspace를 patch하면 aluminum prompt의 perceived count와 newline probability를 조절할 수 있음을 보여준다.	When Models Manipulate Manifolds: rank-6 subspace interventions change perceived character count and linebreak behavior.	patched count별 newline probability와 completion likelihood가 선 그래프로 표시된다.	yes	yes
local:transformer-circuits.pub/2025/linebreaks/images/img-008.png	keep			150-way character count probe response가 diagonal receptive fields와 off-diagonal ringing stripes를 보이는 heatmap.	When Models Manipulate Manifolds: line-character-count probes show widening receptive fields and ringing.	probe count와 true count 축의 heatmap에 diagonal band와 양쪽 ringing stripe가 있다.	yes	yes
local:transformer-circuits.pub/2025/linebreaks/images/img-009.png	keep			mean activation, probe vector, feature decoder similarity에서도 같은 ringing pattern이 나타나 count manifold의 공통 geometry를 보여준다.	When Models Manipulate Manifolds: cosine similarities of mean activations, probes, and decoders all show ringing.	세 개의 red-blue similarity heatmap이 diagonal과 off-diagonal rings를 공유한다.	yes	yes
local:transformer-circuits.pub/2025/linebreaks/images/img-010.png	keep			150차원 ideal circle similarity를 5차원 PCA로 줄이면 ringing과 rippled curve가 자연스럽게 생긴다는 toy construction.	When Models Manipulate Manifolds: low-dimensional approximation of an ideal circle produces ringing and a rippled embedding.	ideal similarity matrix, 5D approximation heatmap, 3D rippled curve projection이 나란히 있다.	yes	yes
local:transformer-circuits.pub/2025/linebreaks/images/img-011.png	keep			n-sphere physical simulation에서 high-curvature circle embedding이 baseball seam 같은 3D curve를 만들고 색상/연도/날짜 manifold 사례와 닮았음을 보여준다.	When Models Manipulate Manifolds: physical simulation yields a high-curvature circle embedding similar to other observed 1D manifolds.	왼쪽은 3D loop curve, 오른쪽은 colors/years/dates PCA projections가 비교된다.	yes	yes
local:transformer-circuits.pub/2025/linebreaks/images/img-012.png	keep			boundary head의 QK가 line width probe와 character count probe를 offset alignment시켜 line boundary 접근을 감지함을 보여준다.	When Models Manipulate Manifolds: boundary-head QK transforms align character count with slightly larger line width.	identity, boundary QK, random QK의 cosine similarity heatmap 세 개가 비교된다.	yes	yes
local:transformer-circuits.pub/2025/linebreaks/images/img-013.png	keep			세 boundary head가 서로 다른 offset으로 count manifold를 twist해 characters remaining을 여러 거리 범위에서 감지하는 비교 heatmap.	When Models Manipulate Manifolds: multiple boundary heads twist count manifolds by different offsets.	세 개 boundary head heatmap에 green argmax line이 서로 다른 offset으로 표시된다.	yes	yes
local:transformer-circuits.pub/2025/linebreaks/images/img-014.png	keep			각 boundary head의 newline attention과 output norm response curve가 서로 다른 characters-remaining 거리에서 peak를 갖는 그래프.	When Models Manipulate Manifolds: boundary heads tile different ranges of characters remaining.	head별 response curve가 characters remaining 축에서 서로 다른 구간에 peak를 가진다.	yes	yes
local:transformer-circuits.pub/2025/linebreaks/images/img-015.png	keep			개별 boundary head output은 거의 1D지만 합치면 characters remaining 공간에서 더 균일한 2D curve를 만드는 PCA projection.	When Models Manipulate Manifolds: sums of multiple boundary heads produce a higher-resolution characters-remaining representation.	개별 head output curve와 summed output curve가 PCA plane에 그려져 있다.	yes	yes
local:transformer-circuits.pub/2025/linebreaks/images/img-016.png	keep			characters remaining subspace를 ablate/patch하면 newline prediction이 바뀌어 boundary estimate representation의 causal role을 검증한다.	When Models Manipulate Manifolds: characters-remaining subspace ablation and intervention causally modulate newline prediction.	loss effect graph와 patched characters-remaining별 completion probability plot이 나란히 있다.	yes	yes
local:transformer-circuits.pub/2025/linebreaks/images/img-017.png	keep			QK attribution으로 previous line width feature와 current character count feature가 boundary-detecting feature를 활성화한다는 discovery path를 보여준다.	When Models Manipulate Manifolds: discovery story shows QK attributions revealing boundary-detecting feature families.	QK attribution snippet과 boundary feature activation curve가 함께 표시된다.	yes	yes
local:transformer-circuits.pub/2025/linebreaks/images/img-018.png	keep			break predictor feature가 say-aluminum feature와 boundary detector input을 합쳐 다음 단어가 line limit을 넘으면 newline logit을 올리는 attribution graph.	When Models Manipulate Manifolds: break predictor graph combines boundary detection with next-word features to predict newline.	say aluminum, boundary detector, predict newline node가 graph edge로 연결되어 있다.	yes	yes
local:transformer-circuits.pub/2025/linebreaks/images/img-019.png	keep			break predictor/suppressor feature activation이 next token length와 characters remaining의 조합에 따라 fit/overflow 영역을 나누는 heatmap.	When Models Manipulate Manifolds: break predictor and suppressor features depend jointly on next-token length and characters remaining.	next token length와 characters remaining 축의 heatmap 세 개가 fit/overflow 경계를 보여준다.	yes	yes
local:transformer-circuits.pub/2025/linebreaks/images/img-020.png	keep			token character length별 embedding 평균이 PCA 공간에서 원형/진동 구조를 이루어 초기 count geometry가 embedding부터 있음을 보여준다.	When Models Manipulate Manifolds: token-length embeddings form a circular and oscillatory structure in PCA space.	token length 1-14 점들이 PC1/PC2/PC3 축에서 고리형 패턴으로 배치된다.	yes	yes
local:transformer-circuits.pub/2025/linebreaks/images/img-021.png	keep			Layer 0 주요 attention heads의 summed output이 character count probes와 내적했을 때 line count를 거칠게 추정하는 모습을 보여준다.	When Models Manipulate Manifolds: summed outputs of important layer-0 heads estimate character count along the line.	token position별 probe inner product heatmap과 true count 비교 plot이 있다.	yes	yes
local:transformer-circuits.pub/2025/linebreaks/images/img-022.png	keep			Layer 0 개별 counting head output을 분해해 각 head가 낮은 rank classification-like contribution으로 count estimate 일부를 담당함을 보여준다.	When Models Manipulate Manifolds: individual layer-0 heads each contribute coarse pieces of the character count estimate.	head별 character-count probe response heatmap이 여러 패널로 나뉘어 있다.	yes	yes
local:transformer-circuits.pub/2025/linebreaks/images/img-023.png	keep			counting heads가 line 초반에는 previous newline을 attention sink로 쓰고 이후 receptive field로 attention을 퍼뜨리는 QK behavior를 보여준다.	When Models Manipulate Manifolds: counting heads specialize by how long they attend to the previous newline sink.	head별 previous-newline attention이 token index에 따라 감소하는 curve가 보인다.	yes	yes
local:transformer-circuits.pub/2025/linebreaks/images/img-024.png	keep			L0H1 counting head의 QK attention, OV token-length correction, output projection을 한 장에 풀어쓴 상세 walkthrough.	When Models Manipulate Manifolds: detailed L0H1 walkthrough connects attention pattern, OV transformation, and count-probe output.	attention pattern, OV output heatmap, probe projection, computation summary가 네 패널로 구성된다.	yes	yes
local:transformer-circuits.pub/2025/linebreaks/images/img-025.png	keep			Muller-Lyer 등 고전적 line-length visual illusion을 소개해 모델 line-count illusion 실험의 비유적 배경을 제공한다.	When Models Manipulate Manifolds: classic visual illusions motivate constructing analogous line-length illusions for language models.	여러 선분 illusion diagram이 작은 패널로 배치되어 있다.	yes	yes
local:transformer-circuits.pub/2025/linebreaks/images/img-026.png	keep			aluminum prompt에 @@ delimiter를 삽입하면 linebreaking prediction이 흐트러져 counting heads가 git-diff cue에 끌리는 현상을 보여준다.	When Models Manipulate Manifolds: inserting @@ into the prompt disrupts newline prediction by distracting counting heads.	원래 prompt와 @@ 삽입 prompt, attention/attribution graph가 비교되어 있다.	yes	yes
local:transformer-circuits.pub/2025/linebreaks/images/img-027.png	keep			@@ 삽입 전후 attention pattern을 비교해 원래 newline-to-newline attention이 @@ token으로도 분산되는 모습을 보여준다.	When Models Manipulate Manifolds: attention pattern comparison shows counting heads attend to inserted @@ as an extra sink.	왼쪽 원본 heatmap과 오른쪽 @@ 삽입 heatmap에서 attention stripe가 추가된다.	yes	yes
local:transformer-circuits.pub/2025/linebreaks/images/img-028.png	keep			180개 two-character insertion 실험에서 code/delimiter-like pair가 newline probability와 head distraction을 크게 흔든다는 scatter.	When Models Manipulate Manifolds: two-character insertion sweep shows delimiter-like strings most disrupt newline prediction.	삽입 문자열별 newline probability와 attention distraction이 점 그래프로 표시된다.	yes	yes
local:transformer-circuits.pub/2025/linebreaks/images/img-030.png	keep			합성 line wrapping task에서 Claude 3.5 Haiku가 line length k에 적응해 세 번째 줄쯤부터 newline을 높은 확률로 맞히는 성능 그래프.	When Models Manipulate Manifolds appendix: task-performance plots show Haiku adapts to line lengths across k values.	line length별 mean log-prob와 accuracy curve가 여러 k값에 대해 표시된다.	yes	yes
local:transformer-circuits.pub/2025/linebreaks/images/img-031.png	keep			서로 다른 dictionary size에서도 character counting feature의 receptive fields가 비슷해 canonical tiling이 나타남을 보여준다.	When Models Manipulate Manifolds appendix: character-count features have similar receptive fields across dictionary sizes.	dictionary size별 feature activation tuning curve들이 겹쳐 비교된다.	yes	yes
local:transformer-circuits.pub/2025/linebreaks/images/img-032.png	keep			feature decoder direction geometry도 dictionary size 간 비슷한 ringing similarity를 보여 character-count manifold가 안정적임을 나타낸다.	When Models Manipulate Manifolds appendix: decoder-direction similarities show consistent ringing across dictionaries.	여러 dictionary의 cosine similarity heatmap이 나란히 있다.	yes	yes
local:transformer-circuits.pub/2025/linebreaks/images/img-033.png	keep			같은 20-45 character range feature가 line width 조건에 따라 all widths, long widths, near-boundary feature로 split되는 예시.	When Models Manipulate Manifolds appendix: feature splitting creates variants of one count range sensitive to line width or boundary proximity.	세 feature의 activation map/curve가 line width와 character count 축에서 비교된다.	yes	yes
local:transformer-circuits.pub/2025/linebreaks/images/img-034.png	keep			line width feature들도 character count feature처럼 width 값을 따라 공간을 tile하는 tuning curve를 갖는다는 부록 그림.	When Models Manipulate Manifolds appendix: line-width features tile the width space similarly to character-count features.	line width 축을 따라 여러 색상 feature tuning curve가 순서대로 활성화된다.	yes	yes
local:transformer-circuits.pub/2025/linebreaks/images/img-035.png	keep			circulant similarity matrix와 Fourier truncation으로 ringing low-rank approximation이 생기는 analytic construction을 보여준다.	When Models Manipulate Manifolds appendix: Fourier construction explains ringing in low-rank approximations of circular similarity.	ideal similarity와 low-rank ringing heatmap, eigen/Fourier 관련 plot이 배치되어 있다.	yes	yes
local:transformer-circuits.pub/2025/linebreaks/images/img-036.png	keep			character count curve에서 Fourier components가 PCA보다 최대 10% 정도만 덜 설명해 Fourier식 manifold 해석이 근사적으로 맞음을 보여준다.	When Models Manipulate Manifolds appendix: Fourier components capture nearly as much variance as PCA components for the count curve.	explained variance curve가 PCA와 Fourier components를 비교한다.	yes	yes
local:transformer-circuits.pub/2025/linebreaks/images/img-037.png	keep			layer가 깊어질수록 character count probe similarity cross-section이 더 뾰족해지고 secondary ringing이 커지는 sharpening 현상.	When Models Manipulate Manifolds appendix: character-count representations sharpen and develop stronger ringing across layers.	layer별 cross-section line plots가 count 30/60/90/120에서 비교된다.	yes	yes
local:transformer-circuits.pub/2025/linebreaks/images/img-038.png	keep			세 QK head가 character count와 line width manifold를 align, left offset, right offset으로 각각 twist하는 cosine similarity 비교.	When Models Manipulate Manifolds appendix: different QK heads align or twist count and width manifolds by different offsets.	세 개의 red-blue cosine similarity heatmap이 offset 방향별로 나란히 있다.	yes	yes
local:transformer-circuits.pub/2025/linebreaks/images/img-039.png	keep			QK를 통과한 probe SVD 공간에서 세 attention head가 count/width manifold를 정렬하거나 좌우로 비트는 방식을 보여준다.	When Models Manipulate Manifolds appendix Geometry of Twisting: SVD in a joint probe basis reveals alignment, left offset, and right offset after QK.	세 개의 3D manifold plot이 head별 정렬 또는 offset 방향을 색상 곡선으로 비교한다.	yes	yes
local:transformer-circuits.pub/2025/linebreaks/images/img-040.png	keep			공동 probe 공간의 첫 3개 성분을 직접 그려 한 head는 정렬을 유지하고 다른 head들은 clockwise/counterclockwise twist를 만든다는 점을 보여준다.	When Models Manipulate Manifolds appendix Geometry of Twisting: the first three joint probe components after QK show alignment versus clockwise and counterclockwise twisting.	세 개의 3D 좌표 plot에서 두 manifold가 head별로 나란히 있거나 서로 회전되어 있다.	yes	yes
local:transformer-circuits.pub/2025/linebreaks/images/img-041.png	keep			초중반 boundary detector feature가 다음 token 길이를 고려하지 않고 남은 character 수만 주로 본다는 활성 패턴.	When Models Manipulate Manifolds appendix Break Predictor Features: boundary detector features around one-third model depth do not account for next-token length.	작은 heatmap 여러 개가 next-token length 변화와 무관한 boundary feature activation을 보여준다.	yes	yes
local:transformer-circuits.pub/2025/linebreaks/images/img-042.png	keep			후반 feature가 남은 character 수와 가장 그럴듯한 다음 token 길이를 함께 반영해 줄바꿈 필요 영역에서만 켜지는 모습.	When Models Manipulate Manifolds appendix Break Predictor Features: later features activate when the likely next token is longer than the characters remaining, below the red diagonal.	빨간 대각선 아래 영역이 강하게 표시된 orange heatmap들이 feature별 activation boundary를 보여준다.	yes	yes
local:transformer-circuits.pub/2025/linebreaks/images/img-043.png	keep			예상 다음 token이 남은 line 공간보다 짧을 때 newline을 억제하는 converse feature들의 활성 영역.	When Models Manipulate Manifolds appendix Break Predictor Features: suppression features fire when the predicted next token is shorter than the characters remaining in the line.	여러 orange heatmap에서 대각선 기준 반대편 활성 영역이 강조되어 break suppression 조건을 보여준다.	yes	yes
local:transformer-circuits.pub/2025/linebreaks/images/img-044.png	keep			줄바꿈 예측/억제 feature가 newline logit뿐 아니라 긴 token을 체계적으로 억제하거나 조정하는 logit effect 비교.	When Models Manipulate Manifolds appendix Break Predictor Features: break prediction and suppression features have interpretable logit effects on newline and token length.	bar chart와 token-length별 효과 plot이 newline excitation/suppression과 긴 token 억제를 함께 보여준다.	yes	yes
local:transformer-circuits.pub/2025/linebreaks/images/img-045.png	keep			Layer 0 feature들이 개별 token의 character count 값에 따라 켜지는 token length representation 예시.	When Models Manipulate Manifolds appendix Representing Token Lengths: layer 0 features activate as a function of individual token character count.	짧은 token부터 긴 token까지 feature activation이 길이 구간별로 배열되어 있다.	yes	yes
local:transformer-circuits.pub/2025/linebreaks/images/img-046.png	keep			단일 attention head가 newline sink와 token 길이 출력을 이용해 line character count에 비례하는 ray를 만들 수 있다는 toy mechanism.	When Models Manipulate Manifolds appendix Mechanics of Head Specialization: a toy construction uses newline attention as a sink and token-length outputs to aggregate character count.	attention sink에서 token별 기여가 누적되어 길이가 달라지는 ray/curve 도식이 보인다.	yes	yes
local:transformer-circuits.pub/2025/linebreaks/images/img-047.png	keep			네 Layer 0 head가 서로 다른 offset에서 newline을 attention sink로 쓰며 line width별 prompt를 나누어 담당하는 패턴.	When Models Manipulate Manifolds appendix Mechanics of Head Specialization: four important layer 0 heads show specialized attention patterns across prompts with different line widths.	4개 head 열과 3개 prompt 행으로 된 attention heatmap에 줄바꿈 위치가 빨간 점선으로 표시된다.	yes	yes
local:transformer-circuits.pub/2025/linebreaks/images/img-048.png	keep			Layer 0 head별 attention이 이전 newline 이후 token 수와 token character length에 따라 어떻게 달라지는지 정량화한 plot.	When Models Manipulate Manifolds appendix Mechanics of Head Specialization: normalized attention is plotted against tokens since newline and individual token length for four heads.	두 개의 line plot 패널이 head별 색상 곡선으로 위치 offset과 긴 token 선호를 비교한다.	yes	yes
local:transformer-circuits.pub/2025/linebreaks/images/img-049.png	keep			Layer 0 head의 OV circuit이 line character count probe와 token length embedding 사이에서 어떤 보정 효과를 쓰는지 보여주는 상호작용 heatmap.	When Models Manipulate Manifolds appendix Mechanics of Head Specialization: P_c^T W_OV E_t measures how four layer 0 heads map token length into line count directions.	네 개의 red-blue heatmap이 token length와 line character count 방향의 inner product를 비교한다.	yes	yes
local:transformer-circuits.pub/2025/linebreaks/images/img-050.png	keep			Layer 1 attention head도 자신이 attend한 token 길이에 맞춰 character count feature 방향으로 쓰는 OV 효과.	When Models Manipulate Manifolds appendix Layer 1 Head OVs: layer 1 heads write to character-count features according to token lengths they attend to.	Layer 1 head별 red-blue heatmap이 token length와 count feature의 대응을 보여준다.	yes	yes
local:transformer-circuits.pub/2025/linebreaks/images/img-051.png	keep			Layer 1 head가 token 길이뿐 아니라 Layer 0의 초기 line length 추정치를 함께 이용해 character count를 정교화하는 패턴.	When Models Manipulate Manifolds appendix Layer 1 Head OVs: layer 1 heads refine character-count estimates using both token length and the line-length estimate built in layer 0.	두 축의 count/length 조건에 따라 색이 달라지는 interaction plot이 Layer 0 추정치 활용을 보여준다.	yes	yes
local:transformer-circuits.pub/2025/linebreaks/images/img-052.png	keep			Layer 0과 Layer 1의 반복 계산이 count representation을 점차 sharpening한다는 현상을 비교한 시각화.	When Models Manipulate Manifolds appendix Layer 1 Head OVs: repeated computations appear responsible for sharpening count representations.	여러 panel의 similarity/activation plot에서 layer가 진행될수록 더 뾰족한 패턴이 나타난다.	yes	yes
